root@lamponubuntu2404-s-1vcpu-1gb-tor1-01:~# tcpdump -i eth0 port 22
tcpdump: verbose output suppressed, use -v[v]... for full protocol decode
listening on eth0, link-type EN10MB (Ethernet), snapshot length 262144 bytes
06:48:13.794233 IP lamponubuntu2404-s-1vcpu-1gb-tor1-01.ssh > 209.141.185.34.59481: Flags [P.], seq 2211332170:2211332278, ack 2111466192, win 473, length 108
06:48:13.794325 IP lamponubuntu2404-s-1vcpu-1gb-tor1-01.ssh > 209.141.185.34.59481: Flags [P.], seq 108:224, ack 1, win 473, length 116
06:48:13.809384 IP 209.141.185.34.59481 > lamponubuntu2404-s-1vcpu-1gb-tor1-01.ssh: Flags [.], ack 0, win 6187, length 0
06:48:13.809384 IP 209.141.185.34.59481 > lamponubuntu2404-s-1vcpu-1gb-tor1-01.ssh: Flags [.], ack 224, win 6193, length 0
06:48:13.809384 IP 209.141.185.34.59481 > lamponubuntu2404-s-1vcpu-1gb-tor1-01.ssh: Flags [P.], seq 1:37, ack 224, win 6193, length 36
06:48:13.809559 IP lamponubuntu2404-s-1vcpu-1gb-tor1-01.ssh > 209.141.185.34.59481: Flags [P.], seq 224:260, ack 37, win 473, length 36
06:48:13.842040 IP 209.141.185.34.59481 > lamponubuntu2404-s-1vcpu-1gb-tor1-01.ssh: Flags [P.], seq 37:73, ack 260, win 6193, length 36
06:48:13.842199 IP lamponubuntu2404-s-1vcpu-1gb-tor1-01.ssh > 209.141.185.34.59481: Flags [P.], seq 260:296, ack 73, win 473, length 36
06:48:13.871552 IP 209.141.185.34.59481 > lamponubuntu2404-s-1vcpu-1gb-tor1-01.ssh: Flags [P.], seq 73:109, ack 296, win 6193, length 36
06:48:13.871699 IP lamponubuntu2404-s-1vcpu-1gb-tor1-01.ssh > 209.141.185.34.59481: Flags [P.], seq 296:332, ack 109, win 473, length 36
06:48:13.899106 IP lamponubuntu2404-s-1vcpu-1gb-tor1-01.ssh > 209.141.185.34.59481: Flags [P.], seq 332:1736, ack 109, win 473, length 1404
06:48:13.902028 IP 209.141.185.34.59481 > lamponubuntu2404-s-1vcpu-1gb-tor1-01.ssh: Flags [P.], seq 109:145, ack 332, win 6193, length 36
06:48:13.902151 IP lamponubuntu2404-s-1vcpu-1gb-tor1-01.ssh > 209.141.185.34.59481: Flags [P.], seq 1736:1772, ack 145, win 473, length 36
06:48:13.915244 IP 209.141.185.34.59481 > lamponubuntu2404-s-1vcpu-1gb-tor1-01.ssh: Flags [.], ack 1736, win 6193, length 0
06:48:13.921756 IP 209.141.185.34.59481 > lamponubuntu2404-s-1vcpu-1gb-tor1-01.ssh: Flags [.], ack 1772, win 6193, length 0
06:48:13.935623 IP 209.141.185.34.59481 > lamponubuntu2404-s-1vcpu-1gb-tor1-01.ssh: Flags [P.], seq 145:181, ack 1772, win 6193, length 36
06:48:13.935817 IP lamponubuntu2404-s-1vcpu-1gb-tor1-01.ssh > 209.141.185.34.59481: Flags [P.], seq 1772:1808, ack 181, win 473, length 36
06:48:13.964324 IP 209.141.185.34.59481 > lamponubuntu2404-s-1vcpu-1gb-tor1-01.ssh: Flags [P.], seq 181:217, ack 1808, win 6193, length 36
06:48:13.964587 IP lamponubuntu2404-s-1vcpu-1gb-tor1-01.ssh > 209.141.185.34.59481: Flags [P.], seq 1808:1844, ack 217, win 473, length 36
06:48:13.997135 IP lamponubuntu2404-s-1vcpu-1gb-tor1-01.ssh > 209.141.185.34.59481: Flags [P.], seq 1844:2024, ack 217, win 473, length 180
06:48:13.997299 IP lamponubuntu2404-s-1vcpu-1gb-tor1-01.ssh > 209.141.185.34.59481: Flags [P.], seq 2024:3148, ack 217, win 473, length 1124
06:48:13.997372 IP 209.141.185.34.59481 > lamponubuntu2404-s-1vcpu-1gb-tor1-01.ssh: Flags [P.], seq 217:253, ack 1844, win 6193, length 36
06:48:13.997428 IP lamponubuntu2404-s-1vcpu-1gb-tor1-01.ssh > 209.141.185.34.59481: Flags [P.], seq 3148:3184, ack 253, win 473, length 36
06:48:14.014830 IP 209.141.185.34.59481 > lamponubuntu2404-s-1vcpu-1gb-tor1-01.ssh: Flags [.], ack 3184, win 6187, length 0
06:48:14.027845 IP 209.141.185.34.59481 > lamponubuntu2404-s-1vcpu-1gb-tor1-01.ssh: Flags [P.], seq 253:289, ack 3184, win 6187, length 36
06:48:14.028049 IP lamponubuntu2404-s-1vcpu-1gb-tor1-01.ssh > 209.141.185.34.59481: Flags [P.], seq 3184:3220, ack 289, win 473, length 36
06:48:14.057862 IP 209.141.185.34.59481 > lamponubuntu2404-s-1vcpu-1gb-tor1-01.ssh: Flags [P.], seq 289:325, ack 3220, win 6193, length 36
06:48:14.058011 IP lamponubuntu2404-s-1vcpu-1gb-tor1-01.ssh > 209.141.185.34.59481: Flags [P.], seq 3220:3256, ack 325, win 473, length 36
06:48:14.090190 IP 209.141.185.34.59481 > lamponubuntu2404-s-1vcpu-1gb-tor1-01.ssh: Flags [P.], seq 325:361, ack 3256, win 6193, length 36
06:48:14.090341 IP lamponubuntu2404-s-1vcpu-1gb-tor1-01.ssh > 209.141.185.34.59481: Flags [P.], seq 3256:3292, ack 361, win 473, length 36
06:48:14.101219 IP lamponubuntu2404-s-1vcpu-1gb-tor1-01.ssh > 209.141.185.34.59481: Flags [P.], seq 3292:4856, ack 361, win 473, length 1564
06:48:14.116029 IP 209.141.185.34.59481 > lamponubuntu2404-s-1vcpu-1gb-tor1-01.ssh: Flags [.], ack 4752, win 6193, length 0
06:48:14.116185 IP 209.141.185.34.59481 > lamponubuntu2404-s-1vcpu-1gb-tor1-01.ssh: Flags [P.], seq 361:397, ack 4856, win 6193, length 36
06:48:14.116326 IP lamponubuntu2404-s-1vcpu-1gb-tor1-01.ssh > 209.141.185.34.59481: Flags [P.], seq 4856:4892, ack 397, win 473, length 36
06:48:14.150721 IP 209.141.185.34.59481 > lamponubuntu2404-s-1vcpu-1gb-tor1-01.ssh: Flags [P.], seq 397:433, ack 4892, win 6193, length 36
06:48:14.150933 IP lamponubuntu2404-s-1vcpu-1gb-tor1-01.ssh > 209.141.185.34.59481: Flags [P.], seq 4892:4928, ack 433, win 473, length 36
06:48:14.181023 IP 209.141.185.34.59481 > lamponubuntu2404-s-1vcpu-1gb-tor1-01.ssh: Flags [P.], seq 433:469, ack 4928, win 6192, length 36
06:48:14.181163 IP lamponubuntu2404-s-1vcpu-1gb-tor1-01.ssh > 209.141.185.34.59481: Flags [P.], seq 4928:4964, ack 469, win 473, length 36
06:48:14.205135 IP lamponubuntu2404-s-1vcpu-1gb-tor1-01.ssh > 209.141.185.34.59481: Flags [P.], seq 4964:5144, ack 469, win 473, length 180
06:48:14.205320 IP lamponubuntu2404-s-1vcpu-1gb-tor1-01.ssh > 209.141.185.34.59481: Flags [P.], seq 5144:6148, ack 469, win 473, length 1004
06:48:14.207158 IP 209.141.185.34.59481 > lamponubuntu2404-s-1vcpu-1gb-tor1-01.ssh: Flags [P.], seq 469:505, ack 4964, win 6192, length 36
06:48:14.207272 IP lamponubuntu2404-s-1vcpu-1gb-tor1-01.ssh > 209.141.185.34.59481: Flags [P.], seq 6148:6184, ack 505, win 473, length 36
06:48:14.219366 IP 209.141.185.34.59481 > lamponubuntu2404-s-1vcpu-1gb-tor1-01.ssh: Flags [.], ack 6148, win 6188, length 0
06:48:14.241352 IP 209.141.185.34.59481 > lamponubuntu2404-s-1vcpu-1gb-tor1-01.ssh: Flags [P.], seq 505:541, ack 6184, win 6188, length 36
06:48:14.241552 IP lamponubuntu2404-s-1vcpu-1gb-tor1-01.ssh > 209.141.185.34.59481: Flags [P.], seq 6184:6220, ack 541, win 473, length 36
06:48:14.271543 IP 209.141.185.34.59481 > lamponubuntu2404-s-1vcpu-1gb-tor1-01.ssh: Flags [P.], seq 541:577, ack 6220, win 6193, length 36
06:48:14.271688 IP lamponubuntu2404-s-1vcpu-1gb-tor1-01.ssh > 209.141.185.34.59481: Flags [P.], seq 6220:6256, ack 577, win 473, length 36
06:48:14.302357 IP 209.141.185.34.59481 > lamponubuntu2404-s-1vcpu-1gb-tor1-01.ssh: Flags [P.], seq 577:613, ack 6256, win 6193, length 36
06:48:14.302530 IP lamponubuntu2404-s-1vcpu-1gb-tor1-01.ssh > 209.141.185.34.59481: Flags [P.], seq 6256:6292, ack 613, win 473, length 36
06:48:14.309323 IP lamponubuntu2404-s-1vcpu-1gb-tor1-01.ssh > 209.141.185.34.59481: Flags [P.], seq 6292:7856, ack 613, win 473, length 1564
06:48:14.323548 IP 209.141.185.34.59481 > lamponubuntu2404-s-1vcpu-1gb-tor1-01.ssh: Flags [.], ack 7856, win 6193, length 0
06:48:14.323549 IP 209.141.185.34.59481 > lamponubuntu2404-s-1vcpu-1gb-tor1-01.ssh: Flags [P.], seq 613:649, ack 7856, win 6193, length 36
06:48:14.323752 IP lamponubuntu2404-s-1vcpu-1gb-tor1-01.ssh > 209.141.185.34.59481: Flags [P.], seq 7856:7892, ack 649, win 473, length 36
06:48:14.346821 IP 209.141.185.34.59481 > lamponubuntu2404-s-1vcpu-1gb-tor1-01.ssh: Flags [P.], seq 649:685, ack 7892, win 6193, length 36
06:48:14.347016 IP lamponubuntu2404-s-1vcpu-1gb-tor1-01.ssh > 209.141.185.34.59481: Flags [P.], seq 7892:7928, ack 685, win 473, length 36
06:48:14.379730 IP 209.141.185.34.59481 > lamponubuntu2404-s-1vcpu-1gb-tor1-01.ssh: Flags [P.], seq 685:721, ack 7928, win 6193, length 36
06:48:14.379908 IP lamponubuntu2404-s-1vcpu-1gb-tor1-01.ssh > 209.141.185.34.59481: Flags [P.], seq 7928:7964, ack 721, win 473, length 36
06:48:14.408845 IP 209.141.185.34.59481 > lamponubuntu2404-s-1vcpu-1gb-tor1-01.ssh: Flags [P.], seq 721:757, ack 7964, win 6193, length 36
06:48:14.409008 IP lamponubuntu2404-s-1vcpu-1gb-tor1-01.ssh > 209.141.185.34.59481: Flags [P.], seq 7964:8000, ack 757, win 473, length 36
06:48:14.413123 IP lamponubuntu2404-s-1vcpu-1gb-tor1-01.ssh > 209.141.185.34.59481: Flags [P.], seq 8000:8180, ack 757, win 473, length 180
06:48:14.413297 IP lamponubuntu2404-s-1vcpu-1gb-tor1-01.ssh > 209.141.185.34.59481: Flags [P.], seq 8180:9464, ack 757, win 473, length 1284
06:48:14.427351 IP 209.141.185.34.59481 > lamponubuntu2404-s-1vcpu-1gb-tor1-01.ssh: Flags [.], ack 8180, win 6192, length 0
06:48:14.439503 IP 209.141.185.34.59481 > lamponubuntu2404-s-1vcpu-1gb-tor1-01.ssh: Flags [P.], seq 757:793, ack 9464, win 6193, length 36
06:48:14.439655 IP lamponubuntu2404-s-1vcpu-1gb-tor1-01.ssh > 209.141.185.34.59481: Flags [P.], seq 9464:9500, ack 793, win 473, length 36
06:48:14.472360 IP 209.141.185.34.59481 > lamponubuntu2404-s-1vcpu-1gb-tor1-01.ssh: Flags [P.], seq 793:829, ack 9500, win 6193, length 36
06:48:14.472572 IP lamponubuntu2404-s-1vcpu-1gb-tor1-01.ssh > 209.141.185.34.59481: Flags [P.], seq 9500:9536, ack 829, win 473, length 36
06:48:14.502860 IP 209.141.185.34.59481 > lamponubuntu2404-s-1vcpu-1gb-tor1-01.ssh: Flags [P.], seq 829:865, ack 9536, win 6193, length 36
06:48:14.503042 IP lamponubuntu2404-s-1vcpu-1gb-tor1-01.ssh > 209.141.185.34.59481: Flags [P.], seq 9536:9572, ack 865, win 473, length 36
06:48:14.517263 IP lamponubuntu2404-s-1vcpu-1gb-tor1-01.ssh > 209.141.185.34.59481: Flags [P.], seq 9572:10856, ack 865, win 473, length 1284
06:48:14.532983 IP 209.141.185.34.59481 > lamponubuntu2404-s-1vcpu-1gb-tor1-01.ssh: Flags [.], ack 10856, win 6188, length 0
06:48:14.532983 IP 209.141.185.34.59481 > lamponubuntu2404-s-1vcpu-1gb-tor1-01.ssh: Flags [P.], seq 865:901, ack 10856, win 6188, length 36
06:48:14.533137 IP lamponubuntu2404-s-1vcpu-1gb-tor1-01.ssh > 209.141.185.34.59481: Flags [P.], seq 10856:10892, ack 901, win 473, length 36
06:48:14.562214 IP 209.141.185.34.59481 > lamponubuntu2404-s-1vcpu-1gb-tor1-01.ssh: Flags [P.], seq 901:937, ack 10892, win 6188, length 36
06:48:14.562406 IP lamponubuntu2404-s-1vcpu-1gb-tor1-01.ssh > 209.141.185.34.59481: Flags [P.], seq 10892:10928, ack 937, win 473, length 36
06:48:14.592813 IP 209.141.185.34.59481 > lamponubuntu2404-s-1vcpu-1gb-tor1-01.ssh: Flags [P.], seq 937:973, ack 10928, win 6193, length 36
06:48:14.593023 IP lamponubuntu2404-s-1vcpu-1gb-tor1-01.ssh > 209.141.185.34.59481: Flags [P.], seq 10928:10964, ack 973, win 473, length 36
06:48:14.621149 IP lamponubuntu2404-s-1vcpu-1gb-tor1-01.ssh > 209.141.185.34.59481: Flags [P.], seq 10964:11144, ack 973, win 473, length 180
06:48:14.621312 IP lamponubuntu2404-s-1vcpu-1gb-tor1-01.ssh > 209.141.185.34.59481: Flags [P.], seq 11144:12156, ack 973, win 473, length 1012
06:48:14.625333 IP 209.141.185.34.59481 > lamponubuntu2404-s-1vcpu-1gb-tor1-01.ssh: Flags [P.], seq 973:1009, ack 10964, win 6193, length 36
06:48:14.625498 IP lamponubuntu2404-s-1vcpu-1gb-tor1-01.ssh > 209.141.185.34.59481: Flags [P.], seq 12156:12192, ack 1009, win 473, length 36
06:48:14.638996 IP 209.141.185.34.59481 > lamponubuntu2404-s-1vcpu-1gb-tor1-01.ssh: Flags [.], ack 12156, win 6188, length 0
06:48:14.655562 IP 209.141.185.34.59481 > lamponubuntu2404-s-1vcpu-1gb-tor1-01.ssh: Flags [P.], seq 1009:1045, ack 12192, win 6188, length 36
06:48:14.655715 IP lamponubuntu2404-s-1vcpu-1gb-tor1-01.ssh > 209.141.185.34.59481: Flags [P.], seq 12192:12228, ack 1045, win 473, length 36
06:48:14.690928 IP 209.141.185.34.59481 > lamponubuntu2404-s-1vcpu-1gb-tor1-01.ssh: Flags [P.], seq 1045:1081, ack 12228, win 6188, length 36
06:48:14.691143 IP lamponubuntu2404-s-1vcpu-1gb-tor1-01.ssh > 209.141.185.34.59481: Flags [P.], seq 12228:12264, ack 1081, win 473, length 36
06:48:14.717992 IP 209.141.185.34.59481 > lamponubuntu2404-s-1vcpu-1gb-tor1-01.ssh: Flags [P.], seq 1081:1117, ack 12264, win 6188, length 36
06:48:14.718170 IP lamponubuntu2404-s-1vcpu-1gb-tor1-01.ssh > 209.141.185.34.59481: Flags [P.], seq 12264:12300, ack 1117, win 473, length 36
06:48:14.725308 IP lamponubuntu2404-s-1vcpu-1gb-tor1-01.ssh > 209.141.185.34.59481: Flags [P.], seq 12300:13896, ack 1117, win 473, length 1596
06:48:14.740350 IP 209.141.185.34.59481 > lamponubuntu2404-s-1vcpu-1gb-tor1-01.ssh: Flags [.], ack 13896, win 6193, length 0
06:48:14.740350 IP 209.141.185.34.59481 > lamponubuntu2404-s-1vcpu-1gb-tor1-01.ssh: Flags [P.], seq 1117:1153, ack 13896, win 6193, length 36
06:48:14.740668 IP lamponubuntu2404-s-1vcpu-1gb-tor1-01.ssh > 209.141.185.34.59481: Flags [P.], seq 13896:13932, ack 1153, win 473, length 36
06:48:14.765002 IP 209.141.185.34.59481 > lamponubuntu2404-s-1vcpu-1gb-tor1-01.ssh: Flags [P.], seq 1153:1189, ack 13932, win 6193, length 36
06:48:14.765840 IP lamponubuntu2404-s-1vcpu-1gb-tor1-01.ssh > 209.141.185.34.59481: Flags [P.], seq 13932:13968, ack 1189, win 473, length 36
06:48:14.795798 IP 209.141.185.34.59481 > lamponubuntu2404-s-1vcpu-1gb-tor1-01.ssh: Flags [P.], seq 1189:1225, ack 13968, win 6193, length 36
06:48:14.795969 IP lamponubuntu2404-s-1vcpu-1gb-tor1-01.ssh > 209.141.185.34.59481: Flags [P.], seq 13968:14004, ack 1225, win 473, length 36
06:48:14.825480 IP 209.141.185.34.59481 > lamponubuntu2404-s-1vcpu-1gb-tor1-01.ssh: Flags [P.], seq 1225:1261, ack 14004, win 6193, length 36
06:48:14.825624 IP lamponubuntu2404-s-1vcpu-1gb-tor1-01.ssh > 209.141.185.34.59481: Flags [P.], seq 14004:14040, ack 1261, win 473, length 36
06:48:14.829130 IP lamponubuntu2404-s-1vcpu-1gb-tor1-01.ssh > 209.141.185.34.59481: Flags [P.], seq 14040:14220, ack 1261, win 473, length 180
06:48:14.829342 IP lamponubuntu2404-s-1vcpu-1gb-tor1-01.ssh > 209.141.185.34.59481: Flags [P.], seq 14220:15528, ack 1261, win 473, length 1308
06:48:14.829386 IP lamponubuntu2404-s-1vcpu-1gb-tor1-01.ssh > 209.141.185.34.59481: Flags [P.], seq 15528:15564, ack 1261, win 473, length 36
06:48:14.841590 IP 209.141.185.34.59481 > lamponubuntu2404-s-1vcpu-1gb-tor1-01.ssh: Flags [.], ack 14220, win 6192, length 0
06:48:14.848355 IP 209.141.185.34.59481 > lamponubuntu2404-s-1vcpu-1gb-tor1-01.ssh: Flags [.], ack 15564, win 6193, length 0
06:48:14.857683 IP 209.141.185.34.59481 > lamponubuntu2404-s-1vcpu-1gb-tor1-01.ssh: Flags [P.], seq 1261:1297, ack 15564, win 6193, length 36
06:48:14.857831 IP lamponubuntu2404-s-1vcpu-1gb-tor1-01.ssh > 209.141.185.34.59481: Flags [P.], seq 15564:15600, ack 1297, win 473, length 36
06:48:14.889736 IP 209.141.185.34.59481 > lamponubuntu2404-s-1vcpu-1gb-tor1-01.ssh: Flags [P.], seq 1297:1333, ack 15600, win 6193, length 36
06:48:14.889939 IP lamponubuntu2404-s-1vcpu-1gb-tor1-01.ssh > 209.141.185.34.59481: Flags [P.], seq 15600:15636, ack 1333, win 473, length 36
06:48:14.919685 IP 209.141.185.34.59481 > lamponubuntu2404-s-1vcpu-1gb-tor1-01.ssh: Flags [P.], seq 1333:1369, ack 15636, win 6193, length 36
06:48:14.919832 IP lamponubuntu2404-s-1vcpu-1gb-tor1-01.ssh > 209.141.185.34.59481: Flags [P.], seq 15636:15672, ack 1369, win 473, length 36
06:48:14.933363 IP lamponubuntu2404-s-1vcpu-1gb-tor1-01.ssh > 209.141.185.34.59481: Flags [P.], seq 15672:17252, ack 1369, win 473, length 1580
06:48:14.947146 IP 209.141.185.34.59481 > lamponubuntu2404-s-1vcpu-1gb-tor1-01.ssh: Flags [.], ack 17252, win 6193, length 0
06:48:14.947147 IP 209.141.185.34.59481 > lamponubuntu2404-s-1vcpu-1gb-tor1-01.ssh: Flags [P.], seq 1369:1405, ack 17252, win 6193, length 36
06:48:14.947297 IP lamponubuntu2404-s-1vcpu-1gb-tor1-01.ssh > 209.141.185.34.59481: Flags [P.], seq 17252:17288, ack 1405, win 473, length 36
06:48:14.980187 IP 209.141.185.34.59481 > lamponubuntu2404-s-1vcpu-1gb-tor1-01.ssh: Flags [P.], seq 1405:1441, ack 17288, win 6193, length 36
06:48:14.980374 IP lamponubuntu2404-s-1vcpu-1gb-tor1-01.ssh > 209.141.185.34.59481: Flags [P.], seq 17288:17324, ack 1441, win 473, length 36
06:48:15.014697 IP 209.141.185.34.59481 > lamponubuntu2404-s-1vcpu-1gb-tor1-01.ssh: Flags [P.], seq 1441:1477, ack 17324, win 6193, length 36
06:48:15.014859 IP lamponubuntu2404-s-1vcpu-1gb-tor1-01.ssh > 209.141.185.34.59481: Flags [P.], seq 17324:17360, ack 1477, win 473, length 36
06:48:15.037193 IP lamponubuntu2404-s-1vcpu-1gb-tor1-01.ssh > 209.141.185.34.59481: Flags [P.], seq 17360:17540, ack 1477, win 473, length 180
06:48:15.037441 IP lamponubuntu2404-s-1vcpu-1gb-tor1-01.ssh > 209.141.185.34.59481: Flags [P.], seq 17540:18560, ack 1477, win 473, length 1020
06:48:15.042786 IP 209.141.185.34.59481 > lamponubuntu2404-s-1vcpu-1gb-tor1-01.ssh: Flags [P.], seq 1477:1513, ack 17360, win 6193, length 36
06:48:15.042941 IP lamponubuntu2404-s-1vcpu-1gb-tor1-01.ssh > 209.141.185.34.59481: Flags [P.], seq 18560:18596, ack 1513, win 473, length 36
06:48:15.053515 IP 209.141.185.34.59481 > lamponubuntu2404-s-1vcpu-1gb-tor1-01.ssh: Flags [.], ack 18560, win 6188, length 0
06:48:15.073143 IP 209.141.185.34.59481 > lamponubuntu2404-s-1vcpu-1gb-tor1-01.ssh: Flags [P.], seq 1513:1549, ack 18596, win 6188, length 36
06:48:15.073305 IP lamponubuntu2404-s-1vcpu-1gb-tor1-01.ssh > 209.141.185.34.59481: Flags [P.], seq 18596:18632, ack 1549, win 473, length 36
06:48:15.101485 IP 209.141.185.34.59481 > lamponubuntu2404-s-1vcpu-1gb-tor1-01.ssh: Flags [P.], seq 1549:1585, ack 18632, win 6188, length 36
06:48:15.101654 IP lamponubuntu2404-s-1vcpu-1gb-tor1-01.ssh > 209.141.185.34.59481: Flags [P.], seq 18632:18668, ack 1585, win 473, length 36
06:48:15.131788 IP 209.141.185.34.59481 > lamponubuntu2404-s-1vcpu-1gb-tor1-01.ssh: Flags [P.], seq 1585:1621, ack 18668, win 6188, length 36
06:48:15.131987 IP lamponubuntu2404-s-1vcpu-1gb-tor1-01.ssh > 209.141.185.34.59481: Flags [P.], seq 18668:18704, ack 1621, win 473, length 36
06:48:15.141299 IP lamponubuntu2404-s-1vcpu-1gb-tor1-01.ssh > 209.141.185.34.59481: Flags [P.], seq 18704:20300, ack 1621, win 473, length 1596
06:48:15.157147 IP 209.141.185.34.59481 > lamponubuntu2404-s-1vcpu-1gb-tor1-01.ssh: Flags [.], ack 20300, win 6193, length 0
06:48:15.157147 IP 209.141.185.34.59481 > lamponubuntu2404-s-1vcpu-1gb-tor1-01.ssh: Flags [P.], seq 1621:1657, ack 20300, win 6193, length 36
06:48:15.157314 IP lamponubuntu2404-s-1vcpu-1gb-tor1-01.ssh > 209.141.185.34.59481: Flags [P.], seq 20300:20336, ack 1657, win 473, length 36
06:48:15.180976 IP 209.141.185.34.59481 > lamponubuntu2404-s-1vcpu-1gb-tor1-01.ssh: Flags [P.], seq 1657:1693, ack 20336, win 6193, length 36
06:48:15.181177 IP lamponubuntu2404-s-1vcpu-1gb-tor1-01.ssh > 209.141.185.34.59481: Flags [P.], seq 20336:20372, ack 1693, win 473, length 36
06:48:15.207491 IP 209.141.185.34.59481 > lamponubuntu2404-s-1vcpu-1gb-tor1-01.ssh: Flags [P.], seq 1693:1729, ack 20372, win 6193, length 36
06:48:15.207652 IP lamponubuntu2404-s-1vcpu-1gb-tor1-01.ssh > 209.141.185.34.59481: Flags [P.], seq 20372:20408, ack 1729, win 473, length 36
06:48:15.241485 IP 209.141.185.34.59481 > lamponubuntu2404-s-1vcpu-1gb-tor1-01.ssh: Flags [P.], seq 1729:1765, ack 20408, win 6193, length 36
06:48:15.241634 IP lamponubuntu2404-s-1vcpu-1gb-tor1-01.ssh > 209.141.185.34.59481: Flags [P.], seq 20408:20444, ack 1765, win 473, length 36
06:48:15.245143 IP lamponubuntu2404-s-1vcpu-1gb-tor1-01.ssh > 209.141.185.34.59481: Flags [P.], seq 20444:20624, ack 1765, win 473, length 180
06:48:15.245333 IP lamponubuntu2404-s-1vcpu-1gb-tor1-01.ssh > 209.141.185.34.59481: Flags [P.], seq 20624:21932, ack 1765, win 473, length 1308
06:48:15.263134 IP 209.141.185.34.59481 > lamponubuntu2404-s-1vcpu-1gb-tor1-01.ssh: Flags [.], ack 20624, win 6192, length 0
06:48:15.271646 IP 209.141.185.34.59481 > lamponubuntu2404-s-1vcpu-1gb-tor1-01.ssh: Flags [P.], seq 1765:1801, ack 21932, win 6193, length 36
06:48:15.271792 IP lamponubuntu2404-s-1vcpu-1gb-tor1-01.ssh > 209.141.185.34.59481: Flags [P.], seq 21932:21968, ack 1801, win 473, length 36
06:48:15.299492 IP 209.141.185.34.59481 > lamponubuntu2404-s-1vcpu-1gb-tor1-01.ssh: Flags [P.], seq 1801:1837, ack 21968, win 6193, length 36
06:48:15.299643 IP lamponubuntu2404-s-1vcpu-1gb-tor1-01.ssh > 209.141.185.34.59481: Flags [P.], seq 21968:22004, ack 1837, win 473, length 36
06:48:15.332133 IP 209.141.185.34.59481 > lamponubuntu2404-s-1vcpu-1gb-tor1-01.ssh: Flags [P.], seq 1837:1873, ack 22004, win 6193, length 36
06:48:15.332312 IP lamponubuntu2404-s-1vcpu-1gb-tor1-01.ssh > 209.141.185.34.59481: Flags [P.], seq 22004:22040, ack 1873, win 473, length 36
