root@lamponubuntu2404-s-1vcpu-1gb-tor1-01:~# tcpdump -r 0001.pcap
reading from file 0001.pcap, link-type EN10MB (Ethernet), snapshot length 262144
06:46:05.719231 IP lamponubuntu2404-s-1vcpu-1gb-tor1-01.ssh > 209.141.185.34.59481: Flags [P.], seq 2211231906:2211231950, ack 2111439996, win 473, length 44
06:46:05.719327 IP lamponubuntu2404-s-1vcpu-1gb-tor1-01.ssh > 209.141.185.34.59481: Flags [P.], seq 44:160, ack 1, win 473, length 116
06:46:05.734347 IP 209.141.185.34.59481 > lamponubuntu2404-s-1vcpu-1gb-tor1-01.ssh: Flags [.], ack 0, win 6192, length 0
06:46:05.734347 IP 209.141.185.34.59481 > lamponubuntu2404-s-1vcpu-1gb-tor1-01.ssh: Flags [P.], seq 1:37, ack 44, win 6192, length 36
06:46:05.734564 IP lamponubuntu2404-s-1vcpu-1gb-tor1-01.ssh > 209.141.185.34.59481: Flags [P.], seq 160:196, ack 37, win 473, length 36
06:46:05.749508 IP 209.141.185.34.59481 > lamponubuntu2404-s-1vcpu-1gb-tor1-01.ssh: Flags [.], ack 196, win 6192, length 0
06:46:05.755867 IP 209.141.185.34.59481 > lamponubuntu2404-s-1vcpu-1gb-tor1-01.ssh: Flags [P.], seq 37:73, ack 196, win 6192, length 36
06:46:05.756032 IP lamponubuntu2404-s-1vcpu-1gb-tor1-01.ssh > 209.141.185.34.59481: Flags [P.], seq 196:232, ack 73, win 473, length 36
06:46:05.786332 IP 209.141.185.34.59481 > lamponubuntu2404-s-1vcpu-1gb-tor1-01.ssh: Flags [P.], seq 73:109, ack 232, win 6192, length 36
06:46:05.786469 IP lamponubuntu2404-s-1vcpu-1gb-tor1-01.ssh > 209.141.185.34.59481: Flags [P.], seq 232:268, ack 109, win 473, length 36
06:46:05.816304 IP 209.141.185.34.59481 > lamponubuntu2404-s-1vcpu-1gb-tor1-01.ssh: Flags [P.], seq 109:145, ack 268, win 6191, length 36
06:46:05.816451 IP lamponubuntu2404-s-1vcpu-1gb-tor1-01.ssh > 209.141.185.34.59481: Flags [P.], seq 268:304, ack 145, win 473, length 36
06:46:05.846519 IP 209.141.185.34.59481 > lamponubuntu2404-s-1vcpu-1gb-tor1-01.ssh: Flags [P.], seq 145:181, ack 304, win 6191, length 36
06:46:05.846672 IP lamponubuntu2404-s-1vcpu-1gb-tor1-01.ssh > 209.141.185.34.59481: Flags [P.], seq 304:340, ack 181, win 473, length 36
06:46:05.876942 IP 209.141.185.34.59481 > lamponubuntu2404-s-1vcpu-1gb-tor1-01.ssh: Flags [P.], seq 181:217, ack 340, win 6191, length 36
06:46:05.877131 IP lamponubuntu2404-s-1vcpu-1gb-tor1-01.ssh > 209.141.185.34.59481: Flags [P.], seq 340:376, ack 217, win 473, length 36
06:46:05.907244 IP 209.141.185.34.59481 > lamponubuntu2404-s-1vcpu-1gb-tor1-01.ssh: Flags [P.], seq 217:253, ack 376, win 6191, length 36
06:46:05.907427 IP lamponubuntu2404-s-1vcpu-1gb-tor1-01.ssh > 209.141.185.34.59481: Flags [P.], seq 376:412, ack 253, win 473, length 36
06:46:05.937337 IP 209.141.185.34.59481 > lamponubuntu2404-s-1vcpu-1gb-tor1-01.ssh: Flags [P.], seq 253:289, ack 412, win 6191, length 36
06:46:05.937527 IP lamponubuntu2404-s-1vcpu-1gb-tor1-01.ssh > 209.141.185.34.59481: Flags [P.], seq 412:448, ack 289, win 473, length 36
06:46:05.967704 IP 209.141.185.34.59481 > lamponubuntu2404-s-1vcpu-1gb-tor1-01.ssh: Flags [P.], seq 289:325, ack 448, win 6191, length 36
06:46:05.967857 IP lamponubuntu2404-s-1vcpu-1gb-tor1-01.ssh > 209.141.185.34.59481: Flags [P.], seq 448:484, ack 325, win 473, length 36
06:46:05.995829 IP 209.141.185.34.59481 > lamponubuntu2404-s-1vcpu-1gb-tor1-01.ssh: Flags [P.], seq 325:361, ack 484, win 6191, length 36
06:46:05.996011 IP lamponubuntu2404-s-1vcpu-1gb-tor1-01.ssh > 209.141.185.34.59481: Flags [P.], seq 484:520, ack 361, win 473, length 36
06:46:06.030478 IP 209.141.185.34.59481 > lamponubuntu2404-s-1vcpu-1gb-tor1-01.ssh: Flags [P.], seq 361:397, ack 520, win 6190, length 36
06:46:06.030651 IP lamponubuntu2404-s-1vcpu-1gb-tor1-01.ssh > 209.141.185.34.59481: Flags [P.], seq 520:556, ack 397, win 473, length 36
06:46:06.060592 IP 209.141.185.34.59481 > lamponubuntu2404-s-1vcpu-1gb-tor1-01.ssh: Flags [P.], seq 397:433, ack 556, win 6190, length 36
06:46:06.060758 IP lamponubuntu2404-s-1vcpu-1gb-tor1-01.ssh > 209.141.185.34.59481: Flags [P.], seq 556:592, ack 433, win 473, length 36
06:46:06.090848 IP 209.141.185.34.59481 > lamponubuntu2404-s-1vcpu-1gb-tor1-01.ssh: Flags [P.], seq 433:469, ack 592, win 6190, length 36
06:46:06.090995 IP lamponubuntu2404-s-1vcpu-1gb-tor1-01.ssh > 209.141.185.34.59481: Flags [P.], seq 592:628, ack 469, win 473, length 36
06:46:06.123040 IP 209.141.185.34.59481 > lamponubuntu2404-s-1vcpu-1gb-tor1-01.ssh: Flags [P.], seq 469:505, ack 628, win 6190, length 36
06:46:06.123190 IP lamponubuntu2404-s-1vcpu-1gb-tor1-01.ssh > 209.141.185.34.59481: Flags [P.], seq 628:664, ack 505, win 473, length 36
06:46:06.153519 IP 209.141.185.34.59481 > lamponubuntu2404-s-1vcpu-1gb-tor1-01.ssh: Flags [P.], seq 505:541, ack 664, win 6190, length 36
06:46:06.153699 IP lamponubuntu2404-s-1vcpu-1gb-tor1-01.ssh > 209.141.185.34.59481: Flags [P.], seq 664:700, ack 541, win 473, length 36
06:46:06.183488 IP 209.141.185.34.59481 > lamponubuntu2404-s-1vcpu-1gb-tor1-01.ssh: Flags [P.], seq 541:577, ack 700, win 6190, length 36
06:46:06.183659 IP lamponubuntu2404-s-1vcpu-1gb-tor1-01.ssh > 209.141.185.34.59481: Flags [P.], seq 700:736, ack 577, win 473, length 36
06:46:06.213842 IP 209.141.185.34.59481 > lamponubuntu2404-s-1vcpu-1gb-tor1-01.ssh: Flags [P.], seq 577:613, ack 736, win 6190, length 36
06:46:06.214006 IP lamponubuntu2404-s-1vcpu-1gb-tor1-01.ssh > 209.141.185.34.59481: Flags [P.], seq 736:772, ack 613, win 473, length 36
06:46:06.244331 IP 209.141.185.34.59481 > lamponubuntu2404-s-1vcpu-1gb-tor1-01.ssh: Flags [P.], seq 613:649, ack 772, win 6189, length 36
06:46:06.244541 IP lamponubuntu2404-s-1vcpu-1gb-tor1-01.ssh > 209.141.185.34.59481: Flags [P.], seq 772:808, ack 649, win 473, length 36
06:46:06.274155 IP 209.141.185.34.59481 > lamponubuntu2404-s-1vcpu-1gb-tor1-01.ssh: Flags [P.], seq 649:685, ack 808, win 6189, length 36
06:46:06.274320 IP lamponubuntu2404-s-1vcpu-1gb-tor1-01.ssh > 209.141.185.34.59481: Flags [P.], seq 808:844, ack 685, win 473, length 36
06:46:06.304621 IP 209.141.185.34.59481 > lamponubuntu2404-s-1vcpu-1gb-tor1-01.ssh: Flags [P.], seq 685:721, ack 844, win 6189, length 36
06:46:06.304810 IP lamponubuntu2404-s-1vcpu-1gb-tor1-01.ssh > 209.141.185.34.59481: Flags [P.], seq 844:880, ack 721, win 473, length 36
06:46:06.336873 IP 209.141.185.34.59481 > lamponubuntu2404-s-1vcpu-1gb-tor1-01.ssh: Flags [P.], seq 721:757, ack 880, win 6189, length 36
06:46:06.337006 IP lamponubuntu2404-s-1vcpu-1gb-tor1-01.ssh > 209.141.185.34.59481: Flags [P.], seq 880:916, ack 757, win 473, length 36
06:46:06.367200 IP 209.141.185.34.59481 > lamponubuntu2404-s-1vcpu-1gb-tor1-01.ssh: Flags [P.], seq 757:793, ack 916, win 6189, length 36
06:46:06.367354 IP lamponubuntu2404-s-1vcpu-1gb-tor1-01.ssh > 209.141.185.34.59481: Flags [P.], seq 916:952, ack 793, win 473, length 36
06:46:06.395302 IP 209.141.185.34.59481 > lamponubuntu2404-s-1vcpu-1gb-tor1-01.ssh: Flags [P.], seq 793:829, ack 952, win 6189, length 36
06:46:06.395437 IP lamponubuntu2404-s-1vcpu-1gb-tor1-01.ssh > 209.141.185.34.59481: Flags [P.], seq 952:988, ack 829, win 473, length 36
06:46:06.427819 IP 209.141.185.34.59481 > lamponubuntu2404-s-1vcpu-1gb-tor1-01.ssh: Flags [P.], seq 829:865, ack 988, win 6189, length 36
06:46:06.427997 IP lamponubuntu2404-s-1vcpu-1gb-tor1-01.ssh > 209.141.185.34.59481: Flags [P.], seq 988:1024, ack 865, win 473, length 36
06:46:06.455657 IP 209.141.185.34.59481 > lamponubuntu2404-s-1vcpu-1gb-tor1-01.ssh: Flags [P.], seq 865:901, ack 1024, win 6188, length 36
06:46:06.455817 IP lamponubuntu2404-s-1vcpu-1gb-tor1-01.ssh > 209.141.185.34.59481: Flags [P.], seq 1024:1060, ack 901, win 473, length 36
06:46:06.488168 IP 209.141.185.34.59481 > lamponubuntu2404-s-1vcpu-1gb-tor1-01.ssh: Flags [P.], seq 901:937, ack 1060, win 6188, length 36
06:46:06.488352 IP lamponubuntu2404-s-1vcpu-1gb-tor1-01.ssh > 209.141.185.34.59481: Flags [P.], seq 1060:1096, ack 937, win 473, length 36
06:46:06.518315 IP 209.141.185.34.59481 > lamponubuntu2404-s-1vcpu-1gb-tor1-01.ssh: Flags [P.], seq 937:973, ack 1096, win 6188, length 36
06:46:06.518471 IP lamponubuntu2404-s-1vcpu-1gb-tor1-01.ssh > 209.141.185.34.59481: Flags [P.], seq 1096:1132, ack 973, win 473, length 36
06:46:06.548840 IP 209.141.185.34.59481 > lamponubuntu2404-s-1vcpu-1gb-tor1-01.ssh: Flags [P.], seq 973:1009, ack 1132, win 6188, length 36
06:46:06.549126 IP lamponubuntu2404-s-1vcpu-1gb-tor1-01.ssh > 209.141.185.34.59481: Flags [P.], seq 1132:1168, ack 1009, win 473, length 36
06:46:06.581033 IP 209.141.185.34.59481 > lamponubuntu2404-s-1vcpu-1gb-tor1-01.ssh: Flags [P.], seq 1009:1045, ack 1168, win 6188, length 36
06:46:06.581184 IP lamponubuntu2404-s-1vcpu-1gb-tor1-01.ssh > 209.141.185.34.59481: Flags [P.], seq 1168:1204, ack 1045, win 473, length 36
06:46:06.608990 IP 209.141.185.34.59481 > lamponubuntu2404-s-1vcpu-1gb-tor1-01.ssh: Flags [P.], seq 1045:1081, ack 1204, win 6188, length 36
06:46:06.609130 IP lamponubuntu2404-s-1vcpu-1gb-tor1-01.ssh > 209.141.185.34.59481: Flags [P.], seq 1204:1240, ack 1081, win 473, length 36
06:46:06.641459 IP 209.141.185.34.59481 > lamponubuntu2404-s-1vcpu-1gb-tor1-01.ssh: Flags [P.], seq 1081:1117, ack 1240, win 6188, length 36
06:46:06.641632 IP lamponubuntu2404-s-1vcpu-1gb-tor1-01.ssh > 209.141.185.34.59481: Flags [P.], seq 1240:1276, ack 1117, win 473, length 36
06:46:06.672047 IP 209.141.185.34.59481 > lamponubuntu2404-s-1vcpu-1gb-tor1-01.ssh: Flags [P.], seq 1117:1153, ack 1276, win 6187, length 36
06:46:06.672210 IP lamponubuntu2404-s-1vcpu-1gb-tor1-01.ssh > 209.141.185.34.59481: Flags [P.], seq 1276:1312, ack 1153, win 473, length 36
06:46:06.702472 IP 209.141.185.34.59481 > lamponubuntu2404-s-1vcpu-1gb-tor1-01.ssh: Flags [P.], seq 1153:1189, ack 1312, win 6193, length 36
06:46:06.703780 IP lamponubuntu2404-s-1vcpu-1gb-tor1-01.ssh > 209.141.185.34.59481: Flags [P.], seq 1312:1348, ack 1189, win 473, length 36
06:46:06.732148 IP 209.141.185.34.59481 > lamponubuntu2404-s-1vcpu-1gb-tor1-01.ssh: Flags [P.], seq 1189:1225, ack 1348, win 6193, length 36
06:46:06.732311 IP lamponubuntu2404-s-1vcpu-1gb-tor1-01.ssh > 209.141.185.34.59481: Flags [P.], seq 1348:1384, ack 1225, win 473, length 36
06:46:06.762468 IP 209.141.185.34.59481 > lamponubuntu2404-s-1vcpu-1gb-tor1-01.ssh: Flags [P.], seq 1225:1261, ack 1384, win 6193, length 36
06:46:06.762623 IP lamponubuntu2404-s-1vcpu-1gb-tor1-01.ssh > 209.141.185.34.59481: Flags [P.], seq 1384:1420, ack 1261, win 473, length 36
06:46:06.792697 IP 209.141.185.34.59481 > lamponubuntu2404-s-1vcpu-1gb-tor1-01.ssh: Flags [P.], seq 1261:1297, ack 1420, win 6193, length 36
06:46:06.792863 IP lamponubuntu2404-s-1vcpu-1gb-tor1-01.ssh > 209.141.185.34.59481: Flags [P.], seq 1420:1456, ack 1297, win 473, length 36
06:46:06.822984 IP 209.141.185.34.59481 > lamponubuntu2404-s-1vcpu-1gb-tor1-01.ssh: Flags [P.], seq 1297:1333, ack 1456, win 6193, length 36
06:46:06.823135 IP lamponubuntu2404-s-1vcpu-1gb-tor1-01.ssh > 209.141.185.34.59481: Flags [P.], seq 1456:1492, ack 1333, win 473, length 36
06:46:06.855468 IP 209.141.185.34.59481 > lamponubuntu2404-s-1vcpu-1gb-tor1-01.ssh: Flags [P.], seq 1333:1369, ack 1492, win 6192, length 36
06:46:06.855666 IP lamponubuntu2404-s-1vcpu-1gb-tor1-01.ssh > 209.141.185.34.59481: Flags [P.], seq 1492:1528, ack 1369, win 473, length 36
06:46:06.885665 IP 209.141.185.34.59481 > lamponubuntu2404-s-1vcpu-1gb-tor1-01.ssh: Flags [P.], seq 1369:1405, ack 1528, win 6192, length 36
06:46:06.885863 IP lamponubuntu2404-s-1vcpu-1gb-tor1-01.ssh > 209.141.185.34.59481: Flags [P.], seq 1528:1564, ack 1405, win 473, length 36
06:46:06.913659 IP 209.141.185.34.59481 > lamponubuntu2404-s-1vcpu-1gb-tor1-01.ssh: Flags [P.], seq 1405:1441, ack 1564, win 6192, length 36
06:46:06.913822 IP lamponubuntu2404-s-1vcpu-1gb-tor1-01.ssh > 209.141.185.34.59481: Flags [P.], seq 1564:1600, ack 1441, win 473, length 36
06:46:06.944107 IP 209.141.185.34.59481 > lamponubuntu2404-s-1vcpu-1gb-tor1-01.ssh: Flags [P.], seq 1441:1477, ack 1600, win 6192, length 36
06:46:06.944303 IP lamponubuntu2404-s-1vcpu-1gb-tor1-01.ssh > 209.141.185.34.59481: Flags [P.], seq 1600:1636, ack 1477, win 473, length 36
06:46:06.976432 IP 209.141.185.34.59481 > lamponubuntu2404-s-1vcpu-1gb-tor1-01.ssh: Flags [P.], seq 1477:1513, ack 1636, win 6192, length 36
06:46:06.976692 IP lamponubuntu2404-s-1vcpu-1gb-tor1-01.ssh > 209.141.185.34.59481: Flags [P.], seq 1636:1672, ack 1513, win 473, length 36
06:46:07.000021 IP 209.141.185.34.59481 > lamponubuntu2404-s-1vcpu-1gb-tor1-01.ssh: Flags [P.], seq 1513:1549, ack 1672, win 6192, length 36
06:46:07.000241 IP lamponubuntu2404-s-1vcpu-1gb-tor1-01.ssh > 209.141.185.34.59481: Flags [P.], seq 1672:1708, ack 1549, win 473, length 36
06:46:07.036696 IP 209.141.185.34.59481 > lamponubuntu2404-s-1vcpu-1gb-tor1-01.ssh: Flags [P.], seq 1549:1585, ack 1708, win 6192, length 36
06:46:07.036851 IP lamponubuntu2404-s-1vcpu-1gb-tor1-01.ssh > 209.141.185.34.59481: Flags [P.], seq 1708:1744, ack 1585, win 473, length 36
06:46:07.075626 IP 209.141.185.34.59481 > lamponubuntu2404-s-1vcpu-1gb-tor1-01.ssh: Flags [P.], seq 1585:1621, ack 1744, win 6191, length 36
06:46:07.075805 IP lamponubuntu2404-s-1vcpu-1gb-tor1-01.ssh > 209.141.185.34.59481: Flags [P.], seq 1744:1780, ack 1621, win 473, length 36
06:46:07.095405 IP 209.141.185.34.59481 > lamponubuntu2404-s-1vcpu-1gb-tor1-01.ssh: Flags [P.], seq 1621:1657, ack 1780, win 6191, length 36
06:46:07.095586 IP lamponubuntu2404-s-1vcpu-1gb-tor1-01.ssh > 209.141.185.34.59481: Flags [P.], seq 1780:1816, ack 1657, win 473, length 36
06:46:07.114581 IP 209.141.185.34.59481 > lamponubuntu2404-s-1vcpu-1gb-tor1-01.ssh: Flags [P.], seq 1657:1693, ack 1816, win 6191, length 36
06:46:07.114727 IP lamponubuntu2404-s-1vcpu-1gb-tor1-01.ssh > 209.141.185.34.59481: Flags [P.], seq 1816:1852, ack 1693, win 473, length 36
06:46:07.146997 IP 209.141.185.34.59481 > lamponubuntu2404-s-1vcpu-1gb-tor1-01.ssh: Flags [P.], seq 1693:1729, ack 1852, win 6191, length 36
06:46:07.147194 IP lamponubuntu2404-s-1vcpu-1gb-tor1-01.ssh > 209.141.185.34.59481: Flags [P.], seq 1852:1888, ack 1729, win 473, length 36
06:46:07.177254 IP 209.141.185.34.59481 > lamponubuntu2404-s-1vcpu-1gb-tor1-01.ssh: Flags [P.], seq 1729:1765, ack 1888, win 6191, length 36
06:46:07.177423 IP lamponubuntu2404-s-1vcpu-1gb-tor1-01.ssh > 209.141.185.34.59481: Flags [P.], seq 1888:1924, ack 1765, win 473, length 36
06:46:07.207463 IP 209.141.185.34.59481 > lamponubuntu2404-s-1vcpu-1gb-tor1-01.ssh: Flags [P.], seq 1765:1801, ack 1924, win 6191, length 36
06:46:07.207641 IP lamponubuntu2404-s-1vcpu-1gb-tor1-01.ssh > 209.141.185.34.59481: Flags [P.], seq 1924:1960, ack 1801, win 473, length 36
06:46:07.237784 IP 209.141.185.34.59481 > lamponubuntu2404-s-1vcpu-1gb-tor1-01.ssh: Flags [P.], seq 1801:1837, ack 1960, win 6191, length 36
06:46:07.237971 IP lamponubuntu2404-s-1vcpu-1gb-tor1-01.ssh > 209.141.185.34.59481: Flags [P.], seq 1960:1996, ack 1837, win 473, length 36
06:46:07.265908 IP 209.141.185.34.59481 > lamponubuntu2404-s-1vcpu-1gb-tor1-01.ssh: Flags [P.], seq 1837:1873, ack 1996, win 6190, length 36
06:46:07.266067 IP lamponubuntu2404-s-1vcpu-1gb-tor1-01.ssh > 209.141.185.34.59481: Flags [P.], seq 1996:2032, ack 1873, win 473, length 36
06:46:07.298059 IP 209.141.185.34.59481 > lamponubuntu2404-s-1vcpu-1gb-tor1-01.ssh: Flags [P.], seq 1873:1909, ack 2032, win 6190, length 36
06:46:07.298205 IP lamponubuntu2404-s-1vcpu-1gb-tor1-01.ssh > 209.141.185.34.59481: Flags [P.], seq 2032:2068, ack 1909, win 473, length 36
06:46:07.330644 IP 209.141.185.34.59481 > lamponubuntu2404-s-1vcpu-1gb-tor1-01.ssh: Flags [P.], seq 1909:1945, ack 2068, win 6190, length 36
06:46:07.330847 IP lamponubuntu2404-s-1vcpu-1gb-tor1-01.ssh > 209.141.185.34.59481: Flags [P.], seq 2068:2104, ack 1945, win 473, length 36
06:46:07.360789 IP 209.141.185.34.59481 > lamponubuntu2404-s-1vcpu-1gb-tor1-01.ssh: Flags [P.], seq 1945:1981, ack 2104, win 6190, length 36
06:46:07.361008 IP lamponubuntu2404-s-1vcpu-1gb-tor1-01.ssh > 209.141.185.34.59481: Flags [P.], seq 2104:2140, ack 1981, win 473, length 36
06:46:07.388758 IP 209.141.185.34.59481 > lamponubuntu2404-s-1vcpu-1gb-tor1-01.ssh: Flags [P.], seq 1981:2017, ack 2140, win 6190, length 36
06:46:07.388943 IP lamponubuntu2404-s-1vcpu-1gb-tor1-01.ssh > 209.141.185.34.59481: Flags [P.], seq 2140:2176, ack 2017, win 473, length 36
06:46:07.429771 IP 209.141.185.34.59481 > lamponubuntu2404-s-1vcpu-1gb-tor1-01.ssh: Flags [P.], seq 2017:2053, ack 2176, win 6190, length 36
06:46:07.429925 IP lamponubuntu2404-s-1vcpu-1gb-tor1-01.ssh > 209.141.185.34.59481: Flags [P.], seq 2176:2212, ack 2053, win 473, length 36
06:46:07.444941 IP 209.141.185.34.59481 > lamponubuntu2404-s-1vcpu-1gb-tor1-01.ssh: Flags [P.], seq 2053:2089, ack 2212, win 6190, length 36
06:46:07.445099 IP lamponubuntu2404-s-1vcpu-1gb-tor1-01.ssh > 209.141.185.34.59481: Flags [P.], seq 2212:2248, ack 2089, win 473, length 36
06:46:07.466671 IP 209.141.185.34.59481 > lamponubuntu2404-s-1vcpu-1gb-tor1-01.ssh: Flags [P.], seq 2089:2125, ack 2248, win 6189, length 36
06:46:07.466872 IP lamponubuntu2404-s-1vcpu-1gb-tor1-01.ssh > 209.141.185.34.59481: Flags [P.], seq 2248:2284, ack 2125, win 473, length 36
06:46:07.498947 IP 209.141.185.34.59481 > lamponubuntu2404-s-1vcpu-1gb-tor1-01.ssh: Flags [P.], seq 2125:2161, ack 2284, win 6189, length 36
06:46:07.499157 IP lamponubuntu2404-s-1vcpu-1gb-tor1-01.ssh > 209.141.185.34.59481: Flags [P.], seq 2284:2320, ack 2161, win 473, length 36
06:46:07.529457 IP 209.141.185.34.59481 > lamponubuntu2404-s-1vcpu-1gb-tor1-01.ssh: Flags [P.], seq 2161:2197, ack 2320, win 6189, length 36
06:46:07.529648 IP lamponubuntu2404-s-1vcpu-1gb-tor1-01.ssh > 209.141.185.34.59481: Flags [P.], seq 2320:2356, ack 2197, win 473, length 36
06:46:07.559607 IP 209.141.185.34.59481 > lamponubuntu2404-s-1vcpu-1gb-tor1-01.ssh: Flags [P.], seq 2197:2233, ack 2356, win 6189, length 36
06:46:07.559812 IP lamponubuntu2404-s-1vcpu-1gb-tor1-01.ssh > 209.141.185.34.59481: Flags [P.], seq 2356:2392, ack 2233, win 473, length 36
06:46:07.591954 IP 209.141.185.34.59481 > lamponubuntu2404-s-1vcpu-1gb-tor1-01.ssh: Flags [P.], seq 2233:2269, ack 2392, win 6189, length 36
06:46:07.592132 IP lamponubuntu2404-s-1vcpu-1gb-tor1-01.ssh > 209.141.185.34.59481: Flags [P.], seq 2392:2428, ack 2269, win 473, length 36
06:46:07.622259 IP 209.141.185.34.59481 > lamponubuntu2404-s-1vcpu-1gb-tor1-01.ssh: Flags [P.], seq 2269:2305, ack 2428, win 6189, length 36
06:46:07.622423 IP lamponubuntu2404-s-1vcpu-1gb-tor1-01.ssh > 209.141.185.34.59481: Flags [P.], seq 2428:2464, ack 2305, win 473, length 36
06:46:07.652378 IP 209.141.185.34.59481 > lamponubuntu2404-s-1vcpu-1gb-tor1-01.ssh: Flags [P.], seq 2305:2341, ack 2464, win 6189, length 36
06:46:07.652639 IP lamponubuntu2404-s-1vcpu-1gb-tor1-01.ssh > 209.141.185.34.59481: Flags [P.], seq 2464:2500, ack 2341, win 473, length 36
06:46:07.684788 IP 209.141.185.34.59481 > lamponubuntu2404-s-1vcpu-1gb-tor1-01.ssh: Flags [P.], seq 2341:2377, ack 2500, win 6188, length 36
06:46:07.684999 IP lamponubuntu2404-s-1vcpu-1gb-tor1-01.ssh > 209.141.185.34.59481: Flags [P.], seq 2500:2536, ack 2377, win 473, length 36
06:46:07.712773 IP 209.141.185.34.59481 > lamponubuntu2404-s-1vcpu-1gb-tor1-01.ssh: Flags [P.], seq 2377:2413, ack 2536, win 6188, length 36
06:46:07.712943 IP lamponubuntu2404-s-1vcpu-1gb-tor1-01.ssh > 209.141.185.34.59481: Flags [P.], seq 2536:2572, ack 2413, win 473, length 36
06:46:07.745249 IP 209.141.185.34.59481 > lamponubuntu2404-s-1vcpu-1gb-tor1-01.ssh: Flags [P.], seq 2413:2449, ack 2572, win 6188, length 36
06:46:07.745419 IP lamponubuntu2404-s-1vcpu-1gb-tor1-01.ssh > 209.141.185.34.59481: Flags [P.], seq 2572:2608, ack 2449, win 473, length 36
06:46:07.775574 IP 209.141.185.34.59481 > lamponubuntu2404-s-1vcpu-1gb-tor1-01.ssh: Flags [P.], seq 2449:2485, ack 2608, win 6188, length 36
06:46:07.775742 IP lamponubuntu2404-s-1vcpu-1gb-tor1-01.ssh > 209.141.185.34.59481: Flags [P.], seq 2608:2644, ack 2485, win 473, length 36
06:46:07.803590 IP 209.141.185.34.59481 > lamponubuntu2404-s-1vcpu-1gb-tor1-01.ssh: Flags [P.], seq 2485:2521, ack 2644, win 6188, length 36
06:46:07.803781 IP lamponubuntu2404-s-1vcpu-1gb-tor1-01.ssh > 209.141.185.34.59481: Flags [P.], seq 2644:2680, ack 2521, win 473, length 36
06:46:07.836058 IP 209.141.185.34.59481 > lamponubuntu2404-s-1vcpu-1gb-tor1-01.ssh: Flags [P.], seq 2521:2557, ack 2680, win 6188, length 36
06:46:07.836215 IP lamponubuntu2404-s-1vcpu-1gb-tor1-01.ssh > 209.141.185.34.59481: Flags [P.], seq 2680:2716, ack 2557, win 473, length 36
06:46:07.866395 IP 209.141.185.34.59481 > lamponubuntu2404-s-1vcpu-1gb-tor1-01.ssh: Flags [P.], seq 2557:2593, ack 2716, win 6188, length 36
06:46:07.866549 IP lamponubuntu2404-s-1vcpu-1gb-tor1-01.ssh > 209.141.185.34.59481: Flags [P.], seq 2716:2752, ack 2593, win 473, length 36
06:46:07.898877 IP 209.141.185.34.59481 > lamponubuntu2404-s-1vcpu-1gb-tor1-01.ssh: Flags [P.], seq 2593:2629, ack 2752, win 6187, length 36
06:46:07.899039 IP lamponubuntu2404-s-1vcpu-1gb-tor1-01.ssh > 209.141.185.34.59481: Flags [P.], seq 2752:2788, ack 2629, win 473, length 36
06:46:07.926763 IP 209.141.185.34.59481 > lamponubuntu2404-s-1vcpu-1gb-tor1-01.ssh: Flags [P.], seq 2629:2665, ack 2788, win 6193, length 36
06:46:07.926920 IP lamponubuntu2404-s-1vcpu-1gb-tor1-01.ssh > 209.141.185.34.59481: Flags [P.], seq 2788:2824, ack 2665, win 473, length 36
06:46:07.961252 IP 209.141.185.34.59481 > lamponubuntu2404-s-1vcpu-1gb-tor1-01.ssh: Flags [P.], seq 2665:2701, ack 2824, win 6193, length 36
06:46:07.961426 IP lamponubuntu2404-s-1vcpu-1gb-tor1-01.ssh > 209.141.185.34.59481: Flags [P.], seq 2824:2860, ack 2701, win 473, length 36
06:46:07.991595 IP 209.141.185.34.59481 > lamponubuntu2404-s-1vcpu-1gb-tor1-01.ssh: Flags [P.], seq 2701:2737, ack 2860, win 6193, length 36
06:46:07.991752 IP lamponubuntu2404-s-1vcpu-1gb-tor1-01.ssh > 209.141.185.34.59481: Flags [P.], seq 2860:2896, ack 2737, win 473, length 36
06:46:08.021788 IP 209.141.185.34.59481 > lamponubuntu2404-s-1vcpu-1gb-tor1-01.ssh: Flags [P.], seq 2737:2773, ack 2896, win 6193, length 36
06:46:08.022022 IP lamponubuntu2404-s-1vcpu-1gb-tor1-01.ssh > 209.141.185.34.59481: Flags [P.], seq 2896:2932, ack 2773, win 473, length 36
06:46:08.051939 IP 209.141.185.34.59481 > lamponubuntu2404-s-1vcpu-1gb-tor1-01.ssh: Flags [P.], seq 2773:2809, ack 2932, win 6193, length 36
06:46:08.052131 IP lamponubuntu2404-s-1vcpu-1gb-tor1-01.ssh > 209.141.185.34.59481: Flags [P.], seq 2932:2968, ack 2809, win 473, length 36
06:46:08.082235 IP 209.141.185.34.59481 > lamponubuntu2404-s-1vcpu-1gb-tor1-01.ssh: Flags [P.], seq 2809:2845, ack 2968, win 6192, length 36
06:46:08.082421 IP lamponubuntu2404-s-1vcpu-1gb-tor1-01.ssh > 209.141.185.34.59481: Flags [P.], seq 2968:3004, ack 2845, win 473, length 36
06:46:08.114733 IP 209.141.185.34.59481 > lamponubuntu2404-s-1vcpu-1gb-tor1-01.ssh: Flags [P.], seq 2845:2881, ack 3004, win 6192, length 36
06:46:08.114905 IP lamponubuntu2404-s-1vcpu-1gb-tor1-01.ssh > 209.141.185.34.59481: Flags [P.], seq 3004:3040, ack 2881, win 473, length 36
06:46:08.144940 IP 209.141.185.34.59481 > lamponubuntu2404-s-1vcpu-1gb-tor1-01.ssh: Flags [P.], seq 2881:2917, ack 3040, win 6192, length 36
06:46:08.145119 IP lamponubuntu2404-s-1vcpu-1gb-tor1-01.ssh > 209.141.185.34.59481: Flags [P.], seq 3040:3076, ack 2917, win 473, length 36
06:46:08.172912 IP 209.141.185.34.59481 > lamponubuntu2404-s-1vcpu-1gb-tor1-01.ssh: Flags [P.], seq 2917:2953, ack 3076, win 6192, length 36
06:46:08.173117 IP lamponubuntu2404-s-1vcpu-1gb-tor1-01.ssh > 209.141.185.34.59481: Flags [P.], seq 3076:3112, ack 2953, win 473, length 36
06:46:08.205373 IP 209.141.185.34.59481 > lamponubuntu2404-s-1vcpu-1gb-tor1-01.ssh: Flags [P.], seq 2953:2989, ack 3112, win 6192, length 36
06:46:08.205530 IP lamponubuntu2404-s-1vcpu-1gb-tor1-01.ssh > 209.141.185.34.59481: Flags [P.], seq 3112:3148, ack 2989, win 473, length 36
06:46:08.235540 IP 209.141.185.34.59481 > lamponubuntu2404-s-1vcpu-1gb-tor1-01.ssh: Flags [P.], seq 2989:3025, ack 3148, win 6192, length 36
06:46:08.235708 IP lamponubuntu2404-s-1vcpu-1gb-tor1-01.ssh > 209.141.185.34.59481: Flags [P.], seq 3148:3184, ack 3025, win 473, length 36
06:46:08.265787 IP 209.141.185.34.59481 > lamponubuntu2404-s-1vcpu-1gb-tor1-01.ssh: Flags [P.], seq 3025:3061, ack 3184, win 6192, length 36
06:46:08.265962 IP lamponubuntu2404-s-1vcpu-1gb-tor1-01.ssh > 209.141.185.34.59481: Flags [P.], seq 3184:3220, ack 3061, win 473, length 36
06:46:08.298352 IP 209.141.185.34.59481 > lamponubuntu2404-s-1vcpu-1gb-tor1-01.ssh: Flags [P.], seq 3061:3097, ack 3220, win 6191, length 36
06:46:08.298498 IP lamponubuntu2404-s-1vcpu-1gb-tor1-01.ssh > 209.141.185.34.59481: Flags [P.], seq 3220:3256, ack 3097, win 473, length 36
06:46:08.328614 IP 209.141.185.34.59481 > lamponubuntu2404-s-1vcpu-1gb-tor1-01.ssh: Flags [P.], seq 3097:3133, ack 3256, win 6191, length 36
06:46:08.328795 IP lamponubuntu2404-s-1vcpu-1gb-tor1-01.ssh > 209.141.185.34.59481: Flags [P.], seq 3256:3292, ack 3133, win 473, length 36
06:46:08.358784 IP 209.141.185.34.59481 > lamponubuntu2404-s-1vcpu-1gb-tor1-01.ssh: Flags [P.], seq 3133:3169, ack 3292, win 6191, length 36
06:46:08.358963 IP lamponubuntu2404-s-1vcpu-1gb-tor1-01.ssh > 209.141.185.34.59481: Flags [P.], seq 3292:3328, ack 3169, win 473, length 36
06:46:08.421222 IP 209.141.185.34.59481 > lamponubuntu2404-s-1vcpu-1gb-tor1-01.ssh: Flags [.], ack 3328, win 6191, length 0
06:46:10.353566 IP windows2019.img-s-2vcpu-2gb-90gb-intel-nyc3-01.44656 > lamponubuntu2404-s-1vcpu-1gb-tor1-01.17275: Flags [S], seq 2116321843, win 1024, length 0
