root@lamponubuntu2404-s-1vcpu-1gb-tor1-01:~# tcpdump -n -i eth0
tcpdump: verbose output suppressed, use -v[v]... for full protocol decode
listening on eth0, link-type EN10MB (Ethernet), snapshot length 262144 bytes
06:47:11.904705 IP 159.203.5.234.22 > 209.141.185.34.59481: Flags [P.], seq 2211275342:2211275450, ack 2111453376, win 473, length 108
06:47:11.904775 IP 159.203.5.234.22 > 209.141.185.34.59481: Flags [P.], seq 108:144, ack 1, win 473, length 36
06:47:11.904829 IP 159.203.5.234.22 > 209.141.185.34.59481: Flags [P.], seq 144:196, ack 1, win 473, length 52
06:47:11.904882 IP 159.203.5.234.22 > 209.141.185.34.59481: Flags [P.], seq 196:264, ack 1, win 473, length 68
06:47:11.904944 IP 159.203.5.234.22 > 209.141.185.34.59481: Flags [P.], seq 264:332, ack 1, win 473, length 68
06:47:11.904973 IP 159.203.5.234.22 > 209.141.185.34.59481: Flags [P.], seq 332:368, ack 1, win 473, length 36
06:47:11.919071 IP 209.141.185.34.59481 > 159.203.5.234.22: Flags [.], ack 264, win 6188, length 0
06:47:11.925385 IP 209.141.185.34.59481 > 159.203.5.234.22: Flags [.], ack 368, win 6188, length 0
06:47:11.934088 IP 209.141.185.34.59481 > 159.203.5.234.22: Flags [P.], seq 1:37, ack 368, win 6188, length 36
06:47:11.934238 IP 159.203.5.234.22 > 209.141.185.34.59481: Flags [P.], seq 368:404, ack 37, win 473, length 36
06:47:11.962250 IP 209.141.185.34.59481 > 159.203.5.234.22: Flags [P.], seq 37:73, ack 404, win 6188, length 36
06:47:11.962399 IP 159.203.5.234.22 > 209.141.185.34.59481: Flags [P.], seq 404:440, ack 73, win 473, length 36
06:47:11.992397 IP 209.141.185.34.59481 > 159.203.5.234.22: Flags [P.], seq 73:109, ack 440, win 6187, length 36
06:47:11.992618 IP 159.203.5.234.22 > 209.141.185.34.59481: Flags [P.], seq 440:476, ack 109, win 473, length 36
06:47:12.005356 IP 159.203.5.234.22 > 209.141.185.34.59481: Flags [P.], seq 476:2088, ack 109, win 473, length 1612
06:47:12.020415 IP 209.141.185.34.59481 > 159.203.5.234.22: Flags [.], ack 2088, win 6193, length 0
06:47:12.020415 IP 209.141.185.34.59481 > 159.203.5.234.22: Flags [P.], seq 109:145, ack 2088, win 6193, length 36
06:47:12.020639 IP 159.203.5.234.22 > 209.141.185.34.59481: Flags [P.], seq 2088:2124, ack 145, win 473, length 36
06:47:12.051346 IP 209.141.185.34.59481 > 159.203.5.234.22: Flags [P.], seq 145:181, ack 2124, win 6193, length 36
06:47:12.051492 IP 159.203.5.234.22 > 209.141.185.34.59481: Flags [P.], seq 2124:2160, ack 181, win 473, length 36
06:47:12.083264 IP 209.141.185.34.59481 > 159.203.5.234.22: Flags [P.], seq 181:217, ack 2160, win 6193, length 36
06:47:12.083430 IP 159.203.5.234.22 > 209.141.185.34.59481: Flags [P.], seq 2160:2196, ack 217, win 473, length 36
06:47:12.109245 IP 159.203.5.234.22 > 209.141.185.34.59481: Flags [P.], seq 2196:3144, ack 217, win 473, length 948
06:47:12.113555 IP 209.141.185.34.59481 > 159.203.5.234.22: Flags [P.], seq 217:253, ack 2196, win 6193, length 36
06:47:12.113707 IP 159.203.5.234.22 > 209.141.185.34.59481: Flags [P.], seq 3144:3180, ack 253, win 473, length 36
06:47:12.128082 IP 209.141.185.34.59481 > 159.203.5.234.22: Flags [.], ack 3180, win 6189, length 0
06:47:12.145627 IP 209.141.185.34.59481 > 159.203.5.234.22: Flags [P.], seq 253:289, ack 3180, win 6189, length 36
06:47:12.145794 IP 159.203.5.234.22 > 209.141.185.34.59481: Flags [P.], seq 3180:3216, ack 289, win 473, length 36
06:47:12.175721 IP 209.141.185.34.59481 > 159.203.5.234.22: Flags [P.], seq 289:325, ack 3216, win 6189, length 36
06:47:12.175884 IP 159.203.5.234.22 > 209.141.185.34.59481: Flags [P.], seq 3216:3252, ack 325, win 473, length 36
06:47:12.207304 IP 209.141.185.34.59481 > 159.203.5.234.22: Flags [P.], seq 325:361, ack 3252, win 6189, length 36
06:47:12.207467 IP 159.203.5.234.22 > 209.141.185.34.59481: Flags [P.], seq 3252:3288, ack 361, win 473, length 36
06:47:12.213137 IP 159.203.5.234.22 > 209.141.185.34.59481: Flags [P.], seq 3288:3444, ack 361, win 473, length 156
06:47:12.213311 IP 159.203.5.234.22 > 209.141.185.34.59481: Flags [P.], seq 3444:4512, ack 361, win 473, length 1068
06:47:12.229903 IP 209.141.185.34.59481 > 159.203.5.234.22: Flags [.], ack 3444, win 6188, length 0
06:47:12.237383 IP 209.141.185.34.59481 > 159.203.5.234.22: Flags [P.], seq 361:397, ack 4512, win 6193, length 36
06:47:12.237559 IP 159.203.5.234.22 > 209.141.185.34.59481: Flags [P.], seq 4512:4548, ack 397, win 473, length 36
06:47:12.271055 IP 209.141.185.34.59481 > 159.203.5.234.22: Flags [P.], seq 397:433, ack 4548, win 6193, length 36
06:47:12.271195 IP 159.203.5.234.22 > 209.141.185.34.59481: Flags [P.], seq 4548:4584, ack 433, win 473, length 36
06:47:12.301266 IP 209.141.185.34.59481 > 159.203.5.234.22: Flags [P.], seq 433:469, ack 4584, win 6193, length 36
06:47:12.301435 IP 159.203.5.234.22 > 209.141.185.34.59481: Flags [P.], seq 4584:4620, ack 469, win 473, length 36
06:47:12.317214 IP 159.203.5.234.22 > 209.141.185.34.59481: Flags [P.], seq 4620:5688, ack 469, win 473, length 1068
06:47:12.329883 IP 209.141.185.34.59481 > 159.203.5.234.22: Flags [P.], seq 469:505, ack 4620, win 6193, length 36
06:47:12.330033 IP 159.203.5.234.22 > 209.141.185.34.59481: Flags [P.], seq 5688:5724, ack 505, win 473, length 36
06:47:12.343364 IP 209.141.185.34.59481 > 159.203.5.234.22: Flags [.], ack 5724, win 6188, length 0
06:47:12.361917 IP 209.141.185.34.59481 > 159.203.5.234.22: Flags [P.], seq 505:541, ack 5724, win 6188, length 36
06:47:12.362092 IP 159.203.5.234.22 > 209.141.185.34.59481: Flags [P.], seq 5724:5760, ack 541, win 473, length 36
06:47:12.396230 IP 209.141.185.34.59481 > 159.203.5.234.22: Flags [P.], seq 541:577, ack 5760, win 6188, length 36
06:47:12.396413 IP 159.203.5.234.22 > 209.141.185.34.59481: Flags [P.], seq 5760:5796, ack 577, win 473, length 36
06:47:12.421134 IP 159.203.5.234.22 > 209.141.185.34.59481: Flags [P.], seq 5796:5952, ack 577, win 473, length 156
06:47:12.421285 IP 159.203.5.234.22 > 209.141.185.34.59481: Flags [P.], seq 5952:6788, ack 577, win 473, length 836
06:47:12.424343 IP 209.141.185.34.59481 > 159.203.5.234.22: Flags [P.], seq 577:613, ack 5796, win 6188, length 36
06:47:12.424478 IP 159.203.5.234.22 > 209.141.185.34.59481: Flags [P.], seq 6788:6824, ack 613, win 473, length 36
06:47:12.435709 IP 209.141.185.34.59481 > 159.203.5.234.22: Flags [.], ack 6788, win 6193, length 0
06:47:12.454540 IP 209.141.185.34.59481 > 159.203.5.234.22: Flags [P.], seq 613:649, ack 6824, win 6193, length 36
06:47:12.454700 IP 159.203.5.234.22 > 209.141.185.34.59481: Flags [P.], seq 6824:6860, ack 649, win 473, length 36
06:47:12.485511 IP 209.141.185.34.59481 > 159.203.5.234.22: Flags [P.], seq 649:685, ack 6860, win 6193, length 36
06:47:12.485652 IP 159.203.5.234.22 > 209.141.185.34.59481: Flags [P.], seq 6860:6896, ack 685, win 473, length 36
06:47:12.517877 IP 209.141.185.34.59481 > 159.203.5.234.22: Flags [P.], seq 685:721, ack 6896, win 6193, length 36
06:47:12.518028 IP 159.203.5.234.22 > 209.141.185.34.59481: Flags [P.], seq 6896:6932, ack 721, win 473, length 36
06:47:12.525212 IP 159.203.5.234.22 > 209.141.185.34.59481: Flags [P.], seq 6932:8232, ack 721, win 473, length 1300
06:47:12.540910 IP 209.141.185.34.59481 > 159.203.5.234.22: Flags [.], ack 8232, win 6187, length 0
06:47:12.540910 IP 209.141.185.34.59481 > 159.203.5.234.22: Flags [P.], seq 721:757, ack 8232, win 6187, length 36
06:47:12.541125 IP 159.203.5.234.22 > 209.141.185.34.59481: Flags [P.], seq 8232:8268, ack 757, win 473, length 36
06:47:12.562595 IP 209.141.185.34.59481 > 159.203.5.234.22: Flags [P.], seq 757:793, ack 8268, win 6193, length 36
06:47:12.562756 IP 159.203.5.234.22 > 209.141.185.34.59481: Flags [P.], seq 8268:8304, ack 793, win 473, length 36
06:47:12.595067 IP 209.141.185.34.59481 > 159.203.5.234.22: Flags [P.], seq 793:829, ack 8304, win 6193, length 36
06:47:12.595209 IP 159.203.5.234.22 > 209.141.185.34.59481: Flags [P.], seq 8304:8340, ack 829, win 473, length 36
06:47:12.621269 IP 209.141.185.34.59481 > 159.203.5.234.22: Flags [P.], seq 829:865, ack 8340, win 6193, length 36
06:47:12.621438 IP 159.203.5.234.22 > 209.141.185.34.59481: Flags [P.], seq 8340:8376, ack 865, win 473, length 36
06:47:12.629179 IP 159.203.5.234.22 > 209.141.185.34.59481: Flags [P.], seq 8376:8532, ack 865, win 473, length 156
06:47:12.629398 IP 159.203.5.234.22 > 209.141.185.34.59481: Flags [P.], seq 8532:9600, ack 865, win 473, length 1068
06:47:12.641560 IP 209.141.185.34.59481 > 159.203.5.234.22: Flags [.], ack 8532, win 6192, length 0
06:47:12.641560 IP 209.141.185.34.59481 > 159.203.5.234.22: Flags [P.], seq 865:901, ack 9600, win 6188, length 36
06:47:12.641727 IP 159.203.5.234.22 > 209.141.185.34.59481: Flags [P.], seq 9600:9636, ack 901, win 473, length 36
06:47:12.667362 IP 209.141.185.34.59481 > 159.203.5.234.22: Flags [P.], seq 901:937, ack 9636, win 6188, length 36
06:47:12.667531 IP 159.203.5.234.22 > 209.141.185.34.59481: Flags [P.], seq 9636:9672, ack 937, win 473, length 36
06:47:12.700900 IP 209.141.185.34.59481 > 159.203.5.234.22: Flags [P.], seq 937:973, ack 9672, win 6188, length 36
06:47:12.701048 IP 159.203.5.234.22 > 209.141.185.34.59481: Flags [P.], seq 9672:9708, ack 973, win 473, length 36
06:47:12.731100 IP 209.141.185.34.59481 > 159.203.5.234.22: Flags [P.], seq 973:1009, ack 9708, win 6187, length 36
06:47:12.731258 IP 159.203.5.234.22 > 209.141.185.34.59481: Flags [P.], seq 9708:9744, ack 1009, win 473, length 36
06:47:12.733182 IP 159.203.5.234.22 > 209.141.185.34.59481: Flags [P.], seq 9744:11044, ack 1009, win 473, length 1300
06:47:12.747558 IP 209.141.185.34.59481 > 159.203.5.234.22: Flags [.], ack 11044, win 6193, length 0
06:47:12.757733 IP 209.141.185.34.59481 > 159.203.5.234.22: Flags [P.], seq 1009:1045, ack 11044, win 6193, length 36
06:47:12.757925 IP 159.203.5.234.22 > 209.141.185.34.59481: Flags [P.], seq 11044:11080, ack 1045, win 473, length 36
06:47:12.791506 IP 209.141.185.34.59481 > 159.203.5.234.22: Flags [P.], seq 1045:1081, ack 11080, win 6193, length 36
06:47:12.791690 IP 159.203.5.234.22 > 209.141.185.34.59481: Flags [P.], seq 11080:11116, ack 1081, win 473, length 36
06:47:12.821689 IP 209.141.185.34.59481 > 159.203.5.234.22: Flags [P.], seq 1081:1117, ack 11116, win 6193, length 36
06:47:12.821841 IP 159.203.5.234.22 > 209.141.185.34.59481: Flags [P.], seq 11116:11152, ack 1117, win 473, length 36
06:47:12.837181 IP 159.203.5.234.22 > 209.141.185.34.59481: Flags [P.], seq 11152:11308, ack 1117, win 473, length 156
06:47:12.837353 IP 159.203.5.234.22 > 209.141.185.34.59481: Flags [P.], seq 11308:12160, ack 1117, win 473, length 852
06:47:12.852222 IP 209.141.185.34.59481 > 159.203.5.234.22: Flags [.], ack 11308, win 6192, length 0
06:47:12.852223 IP 209.141.185.34.59481 > 159.203.5.234.22: Flags [P.], seq 1117:1153, ack 11308, win 6192, length 36
06:47:12.852385 IP 159.203.5.234.22 > 209.141.185.34.59481: Flags [P.], seq 12160:12196, ack 1153, win 473, length 36
06:47:12.869221 IP 209.141.185.34.59481 > 159.203.5.234.22: Flags [.], ack 12196, win 6189, length 0
06:47:12.877868 IP 209.141.185.34.59481 > 159.203.5.234.22: Flags [P.], seq 1153:1189, ack 12196, win 6189, length 36
06:47:12.878033 IP 159.203.5.234.22 > 209.141.185.34.59481: Flags [P.], seq 12196:12232, ack 1189, win 473, length 36
06:47:12.912602 IP 209.141.185.34.59481 > 159.203.5.234.22: Flags [P.], seq 1189:1225, ack 12232, win 6188, length 36
06:47:12.912759 IP 159.203.5.234.22 > 209.141.185.34.59481: Flags [P.], seq 12232:12268, ack 1225, win 473, length 36
06:47:12.941208 IP 159.203.5.234.22 > 209.141.185.34.59481: Flags [P.], seq 12268:13464, ack 1225, win 473, length 1196
06:47:12.942683 IP 209.141.185.34.59481 > 159.203.5.234.22: Flags [P.], seq 1225:1261, ack 12268, win 6188, length 36
06:47:12.942795 IP 159.203.5.234.22 > 209.141.185.34.59481: Flags [P.], seq 13464:13500, ack 1261, win 473, length 36
06:47:12.956298 IP 209.141.185.34.59481 > 159.203.5.234.22: Flags [.], ack 13464, win 6193, length 0
06:47:12.964342 IP 209.141.185.34.59481 > 159.203.5.234.22: Flags [.], ack 13500, win 6193, length 0
06:47:12.970007 IP 209.141.185.34.59481 > 159.203.5.234.22: Flags [P.], seq 1261:1297, ack 13500, win 6193, length 36
06:47:12.970149 IP 159.203.5.234.22 > 209.141.185.34.59481: Flags [P.], seq 13500:13536, ack 1297, win 473, length 36
06:47:12.999875 IP 209.141.185.34.59481 > 159.203.5.234.22: Flags [P.], seq 1297:1333, ack 13536, win 6193, length 36
06:47:13.000013 IP 159.203.5.234.22 > 209.141.185.34.59481: Flags [P.], seq 13536:13572, ack 1333, win 473, length 36
06:47:13.033510 IP 209.141.185.34.59481 > 159.203.5.234.22: Flags [P.], seq 1333:1369, ack 13572, win 6193, length 36
06:47:13.033661 IP 159.203.5.234.22 > 209.141.185.34.59481: Flags [P.], seq 13572:13608, ack 1369, win 473, length 36
06:47:13.045223 IP 159.203.5.234.22 > 209.141.185.34.59481: Flags [P.], seq 13608:14924, ack 1369, win 473, length 1316
06:47:13.060244 IP 209.141.185.34.59481 > 159.203.5.234.22: Flags [.], ack 14924, win 6193, length 0
06:47:13.060244 IP 209.141.185.34.59481 > 159.203.5.234.22: Flags [P.], seq 1369:1405, ack 14924, win 6193, length 36
06:47:13.060395 IP 159.203.5.234.22 > 209.141.185.34.59481: Flags [P.], seq 14924:14960, ack 1405, win 473, length 36
06:47:13.093853 IP 209.141.185.34.59481 > 159.203.5.234.22: Flags [P.], seq 1405:1441, ack 14960, win 6193, length 36
06:47:13.094011 IP 159.203.5.234.22 > 209.141.185.34.59481: Flags [P.], seq 14960:14996, ack 1441, win 473, length 36
06:47:13.123725 IP 209.141.185.34.59481 > 159.203.5.234.22: Flags [P.], seq 1441:1477, ack 14996, win 6193, length 36
06:47:13.123994 IP 159.203.5.234.22 > 209.141.185.34.59481: Flags [P.], seq 14996:15032, ack 1477, win 473, length 36
06:47:13.149226 IP 159.203.5.234.22 > 209.141.185.34.59481: Flags [P.], seq 15032:15188, ack 1477, win 473, length 156
06:47:13.149450 IP 159.203.5.234.22 > 209.141.185.34.59481: Flags [P.], seq 15188:16040, ack 1477, win 473, length 852
06:47:13.156708 IP 209.141.185.34.59481 > 159.203.5.234.22: Flags [P.], seq 1477:1513, ack 15032, win 6193, length 36
06:47:13.156918 IP 159.203.5.234.22 > 209.141.185.34.59481: Flags [P.], seq 16040:16076, ack 1513, win 473, length 36
06:47:13.167495 IP 209.141.185.34.59481 > 159.203.5.234.22: Flags [.], ack 16040, win 6189, length 0
06:47:13.191503 IP 209.141.185.34.59481 > 159.203.5.234.22: Flags [P.], seq 1513:1549, ack 16076, win 6189, length 36
06:47:13.219182 IP 209.141.185.34.59481 > 159.203.5.234.22: Flags [P.], seq 1549:1585, ack 16076, win 6189, length 36
06:47:13.219298 IP 159.203.5.234.22 > 209.141.185.34.59481: Flags [.], ack 1585, win 473, length 0
06:47:13.219349 IP 159.203.5.234.22 > 209.141.185.34.59481: Flags [P.], seq 16076:16112, ack 1585, win 473, length 36
06:47:13.245276 IP 209.141.185.34.59481 > 159.203.5.234.22: Flags [P.], seq 1585:1621, ack 16112, win 6188, length 36
06:47:13.245426 IP 159.203.5.234.22 > 209.141.185.34.59481: Flags [P.], seq 16112:16148, ack 1621, win 473, length 36

